{
  "spec_id": "SPEC-minimal",
  "schema_version": "0.1.0",
  "source_package_id": "PKG-minimal",
  "title": "DataCanvas Demo",
  "slides": [
    {
      "slide_id": "SLIDE-001",
      "title": "DataCanvas",
      "claims": [
        {
          "text": "DataCanvas creates short presentations from structured input packages.",
          "fact_ids": [
            "FACT-001"
          ]
        }
      ]
    }
  ]
}
